{
  "version": "1.0",
  "run_id": "sprint-015-proof",
  "objective": "Create one canonical proof run on the latest harness schema, including work_units, while aligning backend first-slice request validation to the authoritative contracts.",
  "authoritative_inputs": [
    "tools/harness-runtime/specs/product-spec.md",
    "docs/foundation/product-philosophy.md",
    "docs/foundation/governance-model.md",
    "docs/foundation/cloud-handoff.md"
  ],
  "blocking_rule": "If any required input or contract field is ambiguous, stop and write BLOCKED instead of guessing.",
  "in_scope": [
    "Author a canonical proof run that exercises freeze-contract, plan-units, dispatch-unit, collect-unit, gate-units, gate-generator, and gate-close on current main.",
    "Align backend request validation behavior with the first-slice OpenAPI and JSON Schema contracts.",
    "Add backend tests for contract-level validation failures on representative first-slice endpoints."
  ],
  "out_of_scope": [
    "Changing the agreed stack, domain boundaries, or harness scope.",
    "Expanding beyond the first vertical slice resources.",
    "Adding long-running autonomous agent orchestration to the harness runtime."
  ],
  "touched_paths": [
    "apps/backend/build.gradle.kts",
    "apps/backend/src"
  ],
  "acceptance_criteria": [
    {
      "id": "AC-001",
      "statement": "The canonical proof run completes on current main through freeze-contract, plan-units, dispatch-unit, collect-unit, gate-units, gate-generator, and gate-close using the latest work_units schema.",
      "required_evidence": [
        "tools/harness-runtime/artifacts/runs/sprint-015-proof/04_unit_plan.json",
        "tools/harness-runtime/artifacts/runs/sprint-015-proof/05_unit_reports/WU-001.dispatch.json",
        "tools/harness-runtime/artifacts/runs/sprint-015-proof/05_unit_reports/WU-001.evidence.json",
        "tools/harness-runtime/.runner-state/freeze-proofs/sprint-015-proof.json",
        "tools/harness-runtime/.runner-state/baseline-proofs/sprint-015-proof.json",
        "python tools/harness-runtime/scripts/runner.py gate-close --run-id sprint-015-proof"
      ]
    },
    {
      "id": "AC-002",
      "statement": "Backend request validation rejects contract-invalid payloads for the first-slice API before service logic proceeds.",
      "required_evidence": [
        "apps/backend/src/main/kotlin/io/atrielle/aurim/backend/model/Contracts.kt",
        "apps/backend/src/main/kotlin/io/atrielle/aurim/backend/api/WorkspaceController.kt",
        "apps/backend/src/test/kotlin/io/atrielle/aurim/backend/api/ContractValidationTest.kt",
        "apps/backend/gradlew.bat test"
      ]
    }
  ],
  "work_units": [
    {
      "id": "WU-001",
      "title": "Author proof contract and backend validation plan",
      "objective": "Freeze a canonical proof contract and prepare the backend validation change set against the first-slice contracts.",
      "touched_paths": [
        "apps/backend/build.gradle.kts",
        "apps/backend/src"
      ],
      "acceptance_criteria_ids": [
        "AC-001"
      ],
      "required_evidence": [
        "tools/harness-runtime/artifacts/runs/sprint-015-proof/04_unit_plan.json",
        "tools/harness-runtime/artifacts/runs/sprint-015-proof/05_unit_reports/WU-001.dispatch.json"
      ],
      "agent_budget": {
        "max_input_tokens": 12000,
        "max_output_tokens": 3000,
        "depends_on": []
      }
    },
    {
      "id": "WU-002",
      "title": "Implement backend contract validation",
      "objective": "Add request validation and regression tests for representative first-slice backend endpoints.",
      "touched_paths": [
        "apps/backend/build.gradle.kts",
        "apps/backend/src"
      ],
      "acceptance_criteria_ids": [
        "AC-002"
      ],
      "required_evidence": [
        "apps/backend/src/test/kotlin/io/atrielle/aurim/backend/api/ContractValidationTest.kt",
        "apps/backend/gradlew.bat test"
      ],
      "agent_budget": {
        "max_input_tokens": 16000,
        "max_output_tokens": 4000,
        "depends_on": [
          "WU-001"
        ]
      }
    }
  ],
  "evaluator_checks": [
    "Spec was not reinterpreted.",
    "Out-of-scope work was not added.",
    "Changed files stayed within touched paths.",
    "Every acceptance criterion has concrete evidence."
  ]
}
